Dia;Cuenta;Red Social;Tipo de publicacion;Enlace;Comentario;Tema principal;Mes
06-jul;abogadodeextranjeria;Instagram;Reel;https://www.instagram.com/abogadodeextranjeria/reel/Dac_6sciuet/;@abogadodeextranjeria Pau disculpa estoy dentro de mi perfil y no me aparece donde meter mis datos y llenar mi perfil 😩;;Julio
06-jul;abogadodeextranjeria;Instagram;Reel;https://www.instagram.com/abogadodeextranjeria/reel/Dac_6sciuet/;Cómo hacer para apuntar al vacante?;;Julio
06-jul;abogadodeextranjeria;Instagram;Reel;https://www.instagram.com/abogadodeextranjeria/reel/Dac_6sciuet/;Hola buenas tardes, muchas gracias que precio va a tener ?;;Julio
06-jul;abogadodeextranjeria;Instagram;Reel;https://www.instagram.com/abogadodeextranjeria/reel/Dac_6sciuet/;BUENAS tardes Pau muchas gracias, soy venezolana estaba trabajando como cuidadora de adulto mayor y acabo de quedar sin trabajo como hiciera para ingresar a su bolsa de trabajo;;Julio
06-jul;abogadodeextranjeria;Instagram;Reel;https://www.instagram.com/abogadodeextranjeria/reel/Dac_6sciuet/;Bendiciones Pau gracias por pensar en los migrantes Dios te bendiga una pregunta si no tengo estudios también puedo???;;Julio
06-jul;abogadodeextranjeria;Instagram;Reel;https://www.instagram.com/abogadodeextranjeria/reel/Dac_6sciuet/;Buenas tardes yo tengo mi hijo en Colombia él tiene 26 años y maneja toda clase de vehículos y en este momento maneja un camión a mi me gustaría que le resultara un contrato de trabajo para conducir en españa que se podría hacer?;;Julio
06-jul;abogadodeextranjeria;Instagram;Reel;https://www.instagram.com/abogadodeextranjeria/reel/Dac_6sciuet/;Hola Pau yo he metido mucho currículum y nada que me llaman, tengo todas las páginas, dime cuál es el portal para la bolsa dime el link;;Julio
06-jul;abogadodeextranjeria;Instagram;Reel;https://www.instagram.com/abogadodeextranjeria/reel/Dac_6sciuet/;Excelente persona no solo vive para hacer dinero si no que también busca como ayudar a la sociedad que grande bendiciones y éxitos;;Julio
06-jul;abogadodeextranjeria;Instagram;Reel;https://www.instagram.com/abogadodeextranjeria/reel/Dac_6sciuet/;Cuál es el portal;;Julio
06-jul;abogadodeextranjeria;Instagram;Reel;https://www.instagram.com/abogadodeextranjeria/reel/Dac_6sciuet/;Cual es el portal de empleo.;;Julio
06-jul;abogadodeextranjeria;Instagram;Reel;https://www.instagram.com/abogadodeextranjeria/reel/Dac_6sciuet/;El link del portal ??;;Julio
06-jul;abogadodeextranjeria;Instagram;Reel;https://www.instagram.com/abogadodeextranjeria/reel/Dac_6sciuet/;Ya pague el sabado el desistimiento del asilo, cuando entregarian??;;Julio
06-jul;abogadodeextranjeria;Instagram;Reel;https://www.instagram.com/abogadodeextranjeria/reel/Dac_6sciuet/;"Hola, realicé el registro, ya se verificó mi correo, pero no veo en el portal cómo acceder a las vacantes publicadas o cómo registrar el perfil; podrías compartir un vídeo instructivo?";;Julio
06-jul;abogadodeextranjeria;Instagram;Reel;https://www.instagram.com/abogadodeextranjeria/reel/Dac_6sciuet/;Y si no tengo experiencia laboral ?;;Julio
06-jul;abogadodeextranjeria;Instagram;Reel;https://www.instagram.com/abogadodeextranjeria/reel/Dac_6sciuet/;Bendiciones y gracias por tenernos siempre bien informados 🙏🏽🫱🏽‍🫲🏾,en el mundo tienen que haber más personas como vos 🫱🏽‍🫲🏾;;Julio
06-jul;abogadodeextranjeria;Instagram;Reel;https://www.instagram.com/abogadodeextranjeria/reel/Dac_6sciuet/;Doctor buenas tardes una pregunta pero si tenemos una técnica y por su puesto es el sueño de muchos trabajar en lo que estudiamos pero acá no es valido nuestros estudios en que nos puedan ayudar cuidando ,limpieza etc trabajos así. Gracias por la respuesta :;;Julio
06-jul;abogadodeextranjeria;Instagram;Reel;https://www.instagram.com/abogadodeextranjeria/reel/Dac_6sciuet/;Mi madre tiene su nacionalidad española, mi hna también está esperando su residencia con su título homologado y yo tengo mi título homologado de médico general, sigo buscando Visa PAC ya que estoy en mi país natal con mi nena de 3 años. Me parece muy útil y espero lograr conseguir una oferta para ir legalmente.;;Julio
06-jul;abogadodeextranjeria;Instagram;Reel;https://www.instagram.com/abogadodeextranjeria/reel/Dac_6sciuet/;Lo mejor que pueden hacer es pagarles mas a los españoles sueldo minimo 2500, pgar a una niñera para que cuiden de sus hijos asi se animaran a tener hijos listo;;Julio
06-jul;abogadodeextranjeria;Instagram;Reel;https://www.instagram.com/abogadodeextranjeria/reel/Dac_6sciuet/;Dónde está el link @abogadodeextranjeria;;Julio
06-jul;abogadodeextranjeria;Instagram;Reel;https://www.instagram.com/abogadodeextranjeria/reel/Dac_6sciuet/;Gracias informacion soy venezola y soy licenciada en educacion inicial que necesito;;Julio
06-jul;abogadodeextranjeria;Instagram;Reel;https://www.instagram.com/abogadodeextranjeria/reel/Dac_6sciuet/;❤️❤️ tenemos gana de trabajar pau como Podemos hacer imf;;Julio
06-jul;abogadodeextranjeria;Instagram;Reel;https://www.instagram.com/abogadodeextranjeria/reel/Dac_6sciuet/;Muchas gracias, Soy de Venezuela y estoy tramitando mi regularizacion con ustedes. No tengo mi documentación en España para justificar mi currículo. Como podria hacer.;;Julio
06-jul;abogadodeextranjeria;Instagram;Reel;https://www.instagram.com/abogadodeextranjeria/reel/Dac_6sciuet/;Los aprendices del Sena pueden aplicar?;;Julio
06-jul;abogadodeextranjeria;Instagram;Reel;https://www.instagram.com/abogadodeextranjeria/reel/Dac_6sciuet/;Donde encuentro el portal ..??;;Julio
06-jul;abogadodeextranjeria;Instagram;Reel;https://www.instagram.com/abogadodeextranjeria/reel/Dac_6sciuet/;@abogadodeextranjeria amigo Pau, me alegra que estés haciendo esta importante labor. Miles de personas no consiguen trabajo por el sistema que hay en España relacionado con la experiencia y la edad. En mi caso, tengo más de 4 años buscando un empleo en lo que yo me especialice y las empresas nunca me han llamado ni siquiera para hacerme una propuesta de trabajo. Hasta me dijeron que la experiencia laboral debe haberse desarrollado dentro de España y no valoraron los 11 años que tuve en la empresa petrolera en Venezuela. A esto se suma mi edad (65 años) que lo como poca vida laboral. Estarías dispuesto a enfrentar esa batalla? Agradezco tu respuesta🙏🏽;;Julio
06-jul;abogadodeextranjeria;Instagram;Reel;https://www.instagram.com/abogadodeextranjeria/reel/Dac_6sciuet/;Como ago para inscribirme;;Julio
06-jul;abogadodeextranjeria;Instagram;Reel;https://www.instagram.com/abogadodeextranjeria/reel/Dac_6sciuet/;Donde lo busco?;;Julio
02-jul;abogadodeextranjeria;Instagram;Reel;https://www.instagram.com/abogadodeextranjeria/reel/DaS8IJjiAdU/;Hola buenas tardes quería saber cómo puedo hacer para sacar una cita gracias;;Julio
02-jul;abogadodeextranjeria;Instagram;Reel;https://www.instagram.com/abogadodeextranjeria/reel/DaS8IJjiAdU/;Me acuerdo por qué te seguí desde el principio,me impactaste me parecías un tío de 10 un abogado honesto de los que quedan pocos!!❤️❤️❤️;;Julio
02-jul;abogadodeextranjeria;Instagram;Reel;https://www.instagram.com/abogadodeextranjeria/reel/DaS8IJjiAdU/;@abogadodeextranjeria cuando quieras señor abogado estoy a tu disposición.como buen profesional que eres ❤️❤️❤️;;Julio
02-jul;abogadodeextranjeria;Instagram;Reel;https://www.instagram.com/abogadodeextranjeria/reel/DaS8IJjiAdU/;@abogadodeextranjeria cuando tú quieras me dices y lo hacemos;;Julio
02-jul;abogadodeextranjeria;Instagram;Reel;https://www.instagram.com/abogadodeextranjeria/reel/DaS8IJjiAdU/;Buenas tardes, Tengo una cita programada para este mes pero no me permite responder el email para saber si el horario es hora Madrid o donde te encuentro. Agradecería respuesta;;Julio
02-jul;abogadodeextranjeria;Instagram;Reel;https://www.instagram.com/abogadodeextranjeria/reel/DaS8IJjiAdU/;@abogadodeextranjeria me gustaría saber si es hora Madrid u hora del país donde me encuentro.;;Julio
02-jul;abogadodeextranjeria;Instagram;Reel;https://www.instagram.com/abogadodeextranjeria/reel/DaS8IJjiAdU/;Me encanta tu trabajo, quiero una cita. Pero, no consigo cuales son tus métodos de pago? Podrías informarme?;;Julio
02-jul;abogadodeextranjeria;Instagram;Reel;https://www.instagram.com/abogadodeextranjeria/reel/DaS8IJjiAdU/;Hola como hago para comunicarme contigo necesito una asesoría;;Julio
02-jul;abogadodeextranjeria;Instagram;Reel;https://www.instagram.com/abogadodeextranjeria/reel/DaS8IJjiAdU/;Hola,como puedo ponerme en contacto con usted;;Julio
02-jul;abogadodeextranjeria;Instagram;Reel;https://www.instagram.com/abogadodeextranjeria/reel/DaS8IJjiAdU/;Hola Dr , presenté mi documentación el 27 de Abril … sigue en trámite … sé que esto escapa de sus manos 😟, pero quería saber si es normal esto ?;;Julio
02-jul;abogadodeextranjeria;Instagram;Reel;https://www.instagram.com/abogadodeextranjeria/reel/DaS8IJjiAdU/;Hola como hago para comunicarme con Tigo necesito una información ya que llamo escribo nadie me responde;;Julio
02-jul;abogadodeextranjeria;Instagram;Reel;https://www.instagram.com/abogadodeextranjeria/reel/DaS8IJjiAdU/;te felicito eres un excelente abogado pero tú equipo me ha sorprendido porque contraté tú despacho y me han dejado en el limbo para mis trámites solo pediría que supervises bien tu equipo, jamás dudaría de tú capacidad porque usted me inspira para llegar a donde quiero también con sueños ,pero por terceras personas como empresa uno queda mal . saludos y felicidades por tu proyecto en camino 👏;;Julio
02-jul;abogadodeextranjeria;Instagram;Reel;https://www.instagram.com/abogadodeextranjeria/reel/DaS8IJjiAdU/;Pau, necesito contactarme directamente con ustedes, agradecería que me llamaran con urgencia por que por un error de presentación mi proceso se retrasó, necesito una respuesta urgente por que por correo no me responden y al número que llamo no me pueden dar respuesta tampoco.;;Julio
02-jul;abogadodeextranjeria;Instagram;Reel;https://www.instagram.com/abogadodeextranjeria/reel/DaS8IJjiAdU/;Muchas gracias a vos ! Por tu comprensión, empatía y compromiso con nosotros. Particularmente somos una familia que vinimos de Italia donde nos cerraron la puerta en la cara siendo descendientes de italianos y cuando llegamos a España gracias a vos y a tu equipo ya tenemos nuestro permiso por la regularización masiva ✨ eternamente vas a ser el 1 🫶🏾. La disciplina se nota y la responsabilidad también. Gracias 🙏🏽;;Julio
02-jul;abogadodeextranjeria;Instagram;Reel;https://www.instagram.com/abogadodeextranjeria/reel/DaS8IJjiAdU/;Muchas felicidades y bendiciones, tú eres un orgullo para España, fiel seguidora desde Venezuela ojalá tenga la oportunidad de hablar contigo porque hoy estamos necesitando de personas como tú mi esposo es ciudadano español y queremos realizar la reunificación familiar para viajar a España en el nombre de Dios amén 🙏🏻🙏🏻🙏🏻;;Julio
02-jul;abogadodeextranjeria;Instagram;Reel;https://www.instagram.com/abogadodeextranjeria/reel/DaS8IJjiAdU/;Hola buenas tardes estoy en canarias podrías llevar mi caso ? Y de ser así como haríamos para contactar con usted;;Julio
02-jul;abogadodeextranjeria;Instagram;Reel;https://www.instagram.com/abogadodeextranjeria/reel/DaS8IJjiAdU/;Eres un excelente Abogado, y mereces la bendición de Dios 🙏 por ayudar siempre a quienes te necesitan , deseo de todo Corazón que sigas expandiéndose por todo el mundo y que sobre todo piense en una isla que tanto lo necesita , CUBA;;Julio
02-jul;abogadodeextranjeria;Instagram;Reel;https://www.instagram.com/abogadodeextranjeria/reel/DaS8IJjiAdU/;Una pregunta como.se va hacer. Para sacar pape;;Julio
02-jul;abogadodeextranjeria;Instagram;Reel;https://www.instagram.com/abogadodeextranjeria/reel/DaS8IJjiAdU/;Ánimo,cómo todos los que emprendemos,en buscá de emprender;;Julio
02-jul;abogadodeextranjeria;Instagram;Reel;https://www.instagram.com/abogadodeextranjeria/reel/DaS8IJjiAdU/;Que dios bendiga cada acción que haz hecho por nosotros gracias a dios por ponerte en el camino de todos gracias por tomarte el tiempo de explicar cada proceso gracias porque por tí todos tenemos una realidad más clara de cómo hacer las cosas bien y muchos de tus compañeros te han tomado como ejemplo para expresar por las redes lo que muchos no conocemos admiración total a tí 🙌👏;;Julio
02-jul;abogadodeextranjeria;Instagram;Reel;https://www.instagram.com/abogadodeextranjeria/reel/DaS8IJjiAdU/;Admiro al Abogado, pero siento que como persona eres un Gran ser humano, DIOS te bendiga siempre @abogadodeextranjeria 🙏;;Julio
02-jul;abogadodeextranjeria;Instagram;Reel;https://www.instagram.com/abogadodeextranjeria/reel/DaS8IJjiAdU/;El éxito llega cuando se trabaja con Excelencia, honestidad y compromiso 👏🏻;;Julio
02-jul;abogadodeextranjeria;Instagram;Reel;https://www.instagram.com/abogadodeextranjeria/reel/DaS8IJjiAdU/;Hola no tengo manera de comunicarme con inmaculada torremocha , ya pase y pague las entrevistas y ahora quiero pagar el dinero para empezar el proceso ,pero no hay manera nadie me entiendes desde el dia 30 de junio ,estado enviando correos electrónicos, y no los contestan el teléfono tampoco los contestan , hoy porfin me contestaron pero temgo para decir que me mandaron a pagar los 80 € y volver a pedir cita cuando yo ya pague y lo que quería era hacer el primer pago de 200 € para empezar el proceso de nómada digital , ahora estoy en la espera de que se pongan en contacto nuevamente ,mis correos electrónicos nadie los contestan, estoy muy desilusionada con el servicio;;Julio
02-jul;abogadodeextranjeria;Instagram;Reel;https://www.instagram.com/abogadodeextranjeria/reel/DaS8IJjiAdU/;Hola mil disculpas Solo una pregunta si ya presenté mi expediente por correo y el número de NIE me lo asignaron el 1 de julio como hago para pagarlo y aportar el documento si ya termino el plazo de la regulación mil disculpas y gracias;;Julio
02-jul;abogadodeextranjeria;Instagram;Reel;https://www.instagram.com/abogadodeextranjeria/reel/DaS8IJjiAdU/;Feliz dia pau yo tengo meses aqui y estoy en la regularización y quiero que oara el año que vienen me ayuden a ver como traigo a mi familia a España mi esposa y mis dos hijos apenas estoy empezando a trabajar y quiero preparar todo para el año que viene no los contacte porque no tenia como pagar ya que entre en diciembre dia 9 y no tenía permiso de trabajo desde que llegué aqui lo e seguido y gracias por ser un gran abogado dios lo siga bendiciendo;;Julio
02-jul;abogadodeextranjeria;Instagram;Reel;https://www.instagram.com/abogadodeextranjeria/reel/DaS8IJjiAdU/;Donde en Asturias gijon ?;;Julio
02-jul;abogadodeextranjeria;Instagram;Reel;https://www.instagram.com/abogadodeextranjeria/reel/DaS8IJjiAdU/;Nunca en mi vida habría escogido un abogado por redes, pero algo en ti me conectó y me dió la confianza de escogerte como mi abogado en un proceso tan delicado como lo es el migartorio. Saber hacer las cosas bien desde el inicio, es lo más importante. GRACIAS por tu honestidad y ser parte de los buenos en todo sentido. 👏👏👏👏;;Julio
02-jul;abogadodeextranjeria;Instagram;Reel;https://www.instagram.com/abogadodeextranjeria/reel/DaS8IJjiAdU/;Te sigo a pesar que no te conozco Dios me dice que eres sincero y honesto eso es lo mejor que puedes aver en buen abogado;;Julio
02-jul;abogadodeextranjeria;Instagram;Reel;https://www.instagram.com/abogadodeextranjeria/reel/DaS8IJjiAdU/;Hola bendiciones pregunta , ya tenemos el nie cuál es el proceso a seguir;;Julio
02-jul;abogadodeextranjeria;Instagram;Reel;https://www.instagram.com/abogadodeextranjeria/reel/DaS8IJjiAdU/;Si abogado cuando uno se propone a dar un paso adelante con responsabilidad, honestidad y lealtad todos aquellos q vemos ese gran líder lo seguimos y lo apoyamos soy colombiana y estoy aquí en Barcelona y tú es bien llegando a nuestro país . El Dios todopoderoso lo siga bendiciendo en todos sus proyectos y veras metas cumplidas🙏🙏🙏;;Julio
02-jul;abogadodeextranjeria;Instagram;Reel;https://www.instagram.com/abogadodeextranjeria/reel/DaS8IJjiAdU/;Me hubiera encantado ser parte de las personas que tienen buenas noticias contigo Pau. @rudguli @abogadodeextranjeria por favor Pau lo que manifiesta mi esposo en este comentario es real, yo le dije a él, hagamos nuestro proceso con ventura por qué Pau es un hombre que se@preocupa de sus clientes siempre está pendiente y vive el proceso con cada migrante pero me equivoqué fatal. No sé si tu equipo no está comprometido igual pero en nuestro proceso nadie sabe nada, cada vez que llamo me contesta una persona que no tiene ni idea del tema que le dirá a la abogada que me llame y nunca recibo tal llamado. Como puede ser posible que desde el inicio nuestro proceso no fuera bien revisado y por un error básico de abogados tuvimos que llegar un recurso el cual tiene un año de espera y salgo NEGADO, qué pasa??;;Julio
02-jul;abogadodeextranjeria;Instagram;Reel;https://www.instagram.com/abogadodeextranjeria/reel/DaS8IJjiAdU/;Yo y mi esposo queremos aplicar con ustedes el cambio de razones humanitarias a generales pero sale costoso, deberían ofrecer ofertas cuando dos personas;;Julio
02-jul;abogadodeextranjeria;Instagram;Reel;https://www.instagram.com/abogadodeextranjeria/reel/DaS8IJjiAdU/;Eres un gran ser humano. Espero poder contactarte para que me ayuden a obtener mi sueño 🙌;;Julio
30-jun;abogadodeextranjeria;Instagram;Reel;https://www.instagram.com/abogadodeextranjeria/reel/DaNjA-EiTB1/;Gracias Pau por tu solidaridad y apoyo a mi país Venezuela por lo que está pasando y gracias por llevar mi trámite de la regularización ya con mi Nie y seguridad social sólo esperando mi tarjeta en físico Dios te bendiga inmensamente🙏🇻🇪;;Junio
30-jun;abogadodeextranjeria;Instagram;Reel;https://www.instagram.com/abogadodeextranjeria/reel/DaNjA-EiTB1/;Hola Pau he realizado el trámite con vosotros, espero con ansias los resultados, ha sido mi hijo quién se a encargado de presentar toda la documentación que requerías. Un saludo ENORME de mi parte y ojalá tenga suerte, llevo esperando muchísimos años está oportunidad. Gracias Pau y a ti despacho.;;Junio
30-jun;abogadodeextranjeria;Instagram;Reel;https://www.instagram.com/abogadodeextranjeria/reel/DaNjA-EiTB1/;Señor Paul, gracias por todo 🙏 le hago la consulta mi hija de 8 años aún no recibe la notificación de acogida a trámite que se debe hacer ?;;Junio
30-jun;abogadodeextranjeria;Instagram;Reel;https://www.instagram.com/abogadodeextranjeria/reel/DaNjA-EiTB1/;"Un amén bien grande para ti y todo tu equipo; y cómo venezolana les doy las gracias por esas palabras de consuelo, confiando en Dios que podamos salir pronto de está tragedia con el menor número posible de víctimas, muchas gracias 🙏🇻🇪";;Junio
30-jun;abogadodeextranjeria;Instagram;Reel;https://www.instagram.com/abogadodeextranjeria/reel/DaNjA-EiTB1/;Hola Pau yo presente con vosotros la regularización para mi padre el día 8 de junio y a día de hoy no recibo respuesta de admisión a trámite esto quiere decir ir que nos descartan?;;Junio
30-jun;abogadodeextranjeria;Instagram;Reel;https://www.instagram.com/abogadodeextranjeria/reel/DaNjA-EiTB1/;@aandrecc No hay plazo estimado para que respondan las tramitaciones puede variar según la oficina de extranjería asignada y el funcionario que coja el caso. Lo que le podemos indicar es que estos tramites los están resolviendo antes!;;Junio
30-jun;abogadodeextranjeria;Instagram;Reel;https://www.instagram.com/abogadodeextranjeria/reel/DaNjA-EiTB1/;@abogadodeextranjeria para hablar con ustedes como hago busco la manera y me piden es q pague una cita solo quiero una consulta;;Junio
30-jun;abogadodeextranjeria;Instagram;Reel;https://www.instagram.com/abogadodeextranjeria/reel/DaNjA-EiTB1/;@yonder_pernalete hay un número que es de Barcelona que es gratis bro, busca ventura abogados en Google y hay como 2 números que te Dan 1 es de Barcelona a ese llama;;Junio
30-jun;abogadodeextranjeria;Instagram;Reel;https://www.instagram.com/abogadodeextranjeria/reel/DaNjA-EiTB1/;@rii_cciiardo como puedo ver la situación del trámite? Mi cuñado ha enviado todo el papeleo, solo que ahora ya no sé como verlo y el abogado no nos contesta;;Junio
30-jun;abogadodeextranjeria;Instagram;Reel;https://www.instagram.com/abogadodeextranjeria/reel/DaNjA-EiTB1/;@vali_pj3 Hola buen día es costoso los trámites para irse bien a España?;;Junio
30-jun;abogadodeextranjeria;Instagram;Reel;https://www.instagram.com/abogadodeextranjeria/reel/DaNjA-EiTB1/;Hola te quería preguntar si mi proceso aún sale en trámite hay posibilidad de que me den la residencia ?;;Junio
30-jun;abogadodeextranjeria;Instagram;Reel;https://www.instagram.com/abogadodeextranjeria/reel/DaNjA-EiTB1/;@esteban.gb09 No hay plazo estimado para que respondan las tramitaciones puede variar según la oficina de extranjería asignada y el funcionario que coja el caso. Lo que le podemos indicar es que estos tramites los están resolviendo antes!;;Junio
30-jun;abogadodeextranjeria;Instagram;Reel;https://www.instagram.com/abogadodeextranjeria/reel/DaNjA-EiTB1/;Como hacemos para acompañar la evolución del trámite ya que en el link de la Bio ya no aparece regularitzación masiva? Os envío mensaje y no me contestáis? Hemos subido toda la documentación de mi cuñado y estaba todo ok;;Junio
30-jun;abogadodeextranjeria;Instagram;Reel;https://www.instagram.com/abogadodeextranjeria/reel/DaNjA-EiTB1/;Hola!! Nuestros procesos estan rn trámite desde mayo .. ahora la duda es como ves tú lo que el superior ha dicho por lo de la UE? La noticia que salió hoy ?;;Junio
30-jun;abogadodeextranjeria;Instagram;Reel;https://www.instagram.com/abogadodeextranjeria/reel/DaNjA-EiTB1/;Pau, necesito contactarme directamente con ustedes, agradecería que me llamaran con urgencia por que por un error de presentación mi proceso se retrasó, necesito una respuesta urgente por que por correo no me responden y al número que llamo no me pueden dar respuesta tampoco.;;Junio
30-jun;abogadodeextranjeria;Instagram;Reel;https://www.instagram.com/abogadodeextranjeria/reel/DaNjA-EiTB1/;@guido_tomas ahora supuestamente tengo que esperar DOS AÑOS MÁS PARA MI PASAPORTE cuando ya estuve dos años;;Junio
30-jun;abogadodeextranjeria;Instagram;Reel;https://www.instagram.com/abogadodeextranjeria/reel/DaNjA-EiTB1/;"@yudexmc3 ""La residencia por razones humanitarias no es un premio de consolación ni un derecho automático. Si fuera así, habría que concedérsela a millones de personas de países en crisis."" El problema de Venezuela es real, y nadie que está por fuera. Tiene derecho de aprovecharse de la situación para obtener una residencia, en este momento el venezolano que vale es el que está en el país pasando dicha desgracia. No tu que estás en España pidiendo una residencia a costilla de la desgracia de otros.";;Junio
30-jun;abogadodeextranjeria;Instagram;Reel;https://www.instagram.com/abogadodeextranjeria/reel/DaNjA-EiTB1/;@giafassssssssss no entiendo que genera risa ?;;Junio
30-jun;abogadodeextranjeria;Instagram;Reel;https://www.instagram.com/abogadodeextranjeria/reel/DaNjA-EiTB1/;@isamar22leon la ignorancia es tan atrevida, ya sabemos que careces de inteligencia pero ajá, si ya está en España me imagino que la está pidiendo para los que están en Venezuela atravesando situaciones difíciles, pero no creo que tú 🧠 pueda procesar esa información;;Junio
30-jun;abogadodeextranjeria;Instagram;Reel;https://www.instagram.com/abogadodeextranjeria/reel/DaNjA-EiTB1/;@karent_kari obviamente su solicitud. Por qué? Isamar ya lo dijo.;;Junio
30-jun;abogadodeextranjeria;Instagram;Reel;https://www.instagram.com/abogadodeextranjeria/reel/DaNjA-EiTB1/;@karent_kari Aprovecharse de un país golpeado no es inteligencia, es oportunismo. Por eso es que estamos como estamos, mijaaa hay muchas maneras de tener documentos. No espera la oportunidad de una situación así.;;Junio
30-jun;abogadodeextranjeria;Instagram;Reel;https://www.instagram.com/abogadodeextranjeria/reel/DaNjA-EiTB1/;@karent_kari usted no están hablando por lo que están allá ustedes están hablando por ustedes acá, por eso doy mi comentario. Bien si le gusto o no. Me da arrechera el Venezolano que no cambia pana que siempre busca por la desgracia de alguien la oportunidad de ellos. Así o más claro ya lo entendíste;;Junio
30-jun;abogadodeextranjeria;Instagram;Reel;https://www.instagram.com/abogadodeextranjeria/reel/DaNjA-EiTB1/;@yudexmc3 con su perdon! Agradeced a quien os tienen benevolencia! Tr acuerdas del porque os lo quitaron ? Aprender a pensar un poco en los demás!;;Junio
30-jun;abogadodeextranjeria;Instagram;Reel;https://www.instagram.com/abogadodeextranjeria/reel/DaNjA-EiTB1/;@yudexmc3 asiendo tanta gente en espera?;;Junio
30-jun;abogadodeextranjeria;Instagram;Reel;https://www.instagram.com/abogadodeextranjeria/reel/DaNjA-EiTB1/;Por favor! ... 🙏 Expliquen que debemos hacer luego de la admisión a trámite. No sé si debo esperar mi nro de seguridad social o debo ir a solicitarlo para poder trabajar.;;Junio
30-jun;abogadodeextranjeria;Instagram;Reel;https://www.instagram.com/abogadodeextranjeria/reel/DaNjA-EiTB1/;@jofrelescanovillanueva En el documento de administración a trámite, te sale toda la explicación de qué debes hacer ahora, cuáles son los pasos a seguir y a qué tienes derecho. Léelo el detalle y responderás muchas de tus preguntas.;;Junio
