Dia;Cuenta;Red Social;Tipo de publicacion;Enlace;Comentario;Tema principal;Mes
10-jul;abogadodeextranjeria;Instagram;Reel;https://www.instagram.com/abogadodeextranjeria/reel/DanHZ2Pu3bS/;La cita de las huellas la pido yo, o me la dan ustedes?;;Julio
10-jul;abogadodeextranjeria;Instagram;Reel;https://www.instagram.com/abogadodeextranjeria/reel/DanHZ2Pu3bS/;cuánto sale hacer ese trámite con ustedes?;;Julio
10-jul;abogadodeextranjeria;Instagram;Reel;https://www.instagram.com/abogadodeextranjeria/reel/DanHZ2Pu3bS/;Cómo puedo pedir cita para una reagrupación familiar de un hijo;;Julio
10-jul;abogadodeextranjeria;Instagram;Reel;https://www.instagram.com/abogadodeextranjeria/reel/DanHZ2Pu3bS/;Los padres entran a ese trámite de reagrupación?;;Julio
10-jul;abogadodeextranjeria;Instagram;Reel;https://www.instagram.com/abogadodeextranjeria/reel/DanHZ2Pu3bS/;Los hermanos y sobrinos entran en la reagrupación familiar?;;Julio
10-jul;abogadodeextranjeria;Instagram;Reel;https://www.instagram.com/abogadodeextranjeria/reel/DanHZ2Pu3bS/;Mi esposo hizo la regularización, me pueden dar el permiso de residencia a mi?;;Julio
10-jul;abogadodeextranjeria;Instagram;Reel;https://www.instagram.com/abogadodeextranjeria/reel/DanHZ2Pu3bS/;@aimar.bci no estas escuchando que si?;;Julio
10-jul;abogadodeextranjeria;Instagram;Reel;https://www.instagram.com/abogadodeextranjeria/reel/DanHZ2Pu3bS/;Y afecta para el canje de la licencia, tengo entendido que uno tiene un periodo de 6 meses para hacer el trámite pero como empieza a computar desde el admitido a tramite;;Julio
10-jul;abogadodeextranjeria;Instagram;Reel;https://www.instagram.com/abogadodeextranjeria/reel/DanHZ2Pu3bS/;Buenas una consulta? Porque demoran las solicitudes solo salen en trámite es normal k demoren? O en cuantos meses está eso?;;Julio
10-jul;abogadodeextranjeria;Instagram;Reel;https://www.instagram.com/abogadodeextranjeria/reel/DanHZ2Pu3bS/;Los padres entran en el trámite de reagrupación?;;Julio
10-jul;abogadodeextranjeria;Instagram;Reel;https://www.instagram.com/abogadodeextranjeria/reel/DanHZ2Pu3bS/;Los padres no entran en la reagrupación familiar?;;Julio
10-jul;abogadodeextranjeria;Instagram;Reel;https://www.instagram.com/abogadodeextranjeria/reel/DanHZ2Pu3bS/;Padres y hermanos entran a ese trámite de reagrupación??;;Julio
10-jul;abogadodeextranjeria;Instagram;Reel;https://www.instagram.com/abogadodeextranjeria/reel/DanHZ2Pu3bS/;Los hermanos también entran en la reagrupacion?;;Julio
10-jul;abogadodeextranjeria;Instagram;Reel;https://www.instagram.com/abogadodeextranjeria/reel/DanHZ2Pu3bS/;Si mi pareja y mi hija ya están acá puedo igual hacerlo? Por qué ellos recién llegaron en junio ? @abogadodeextranjeria;;Julio
10-jul;abogadodeextranjeria;Instagram;Reel;https://www.instagram.com/abogadodeextranjeria/reel/DanHZ2Pu3bS/;Si se tiene dos hijas mayores sin discapacidad, pero solteras, se puede agrupar ?;;Julio
10-jul;abogadodeextranjeria;Instagram;Reel;https://www.instagram.com/abogadodeextranjeria/reel/DanHZ2Pu3bS/;Y si mis padres están dentro de la territorio que sucede. ?;;Julio
10-jul;abogadodeextranjeria;Instagram;Reel;https://www.instagram.com/abogadodeextranjeria/reel/DanHZ2Pu3bS/;Quiero saver si le puedo hacer reagrupación a mi madre y mi hermano que es menor;;Julio
10-jul;abogadodeextranjeria;Instagram;Reel;https://www.instagram.com/abogadodeextranjeria/reel/DanHZ2Pu3bS/;Los hermanos entran en la reagrupación familiar?;;Julio
10-jul;abogadodeextranjeria;Instagram;Reel;https://www.instagram.com/abogadodeextranjeria/reel/DanHZ2Pu3bS/;Hola , y los padres?;;Julio
10-jul;abogadodeextranjeria;Instagram;Reel;https://www.instagram.com/abogadodeextranjeria/reel/DanHZ2Pu3bS/;Tengo un mes que deposite y no recibo noticias de nada 😢😢😢 es poco tiempo para esperar respuesta ?;;Julio
10-jul;abogadodeextranjeria;Instagram;Reel;https://www.instagram.com/abogadodeextranjeria/reel/DanHZ2Pu3bS/;Y los padres?;;Julio
10-jul;abogadodeextranjeria;Instagram;Reel;https://www.instagram.com/abogadodeextranjeria/reel/DanHZ2Pu3bS/;Los padres entran?;;Julio
10-jul;abogadodeextranjeria;Instagram;Reel;https://www.instagram.com/abogadodeextranjeria/reel/DanHZ2Pu3bS/;Lo tiempo com tarjeta roja cuenta también?;;Julio
10-jul;abogadodeextranjeria;Instagram;Reel;https://www.instagram.com/abogadodeextranjeria/reel/DanHZ2Pu3bS/;Paul ase poco nació mi hija cómo es para la nacionalidad por simplepersucion somos colombianos;;Julio
10-jul;abogadodeextranjeria;Instagram;Reel;https://www.instagram.com/abogadodeextranjeria/reel/DanHZ2Pu3bS/;Hola Pau, tengo nacionalidad Española… yo puedo reagrupar a mi abuela materna? Está en Venezuela.;;Julio
10-jul;abogadodeextranjeria;Instagram;Reel;https://www.instagram.com/abogadodeextranjeria/reel/DanHZ2Pu3bS/;Los hijos mayores de 26 yo con nacionalidad española??🙌;;Julio
10-jul;abogadodeextranjeria;Instagram;Reel;https://www.instagram.com/abogadodeextranjeria/reel/DanHZ2Pu3bS/;Hola Pau los padres y hermanos entran en la reagrupación familiar. ?;;Julio
10-jul;abogadodeextranjeria;Instagram;Reel;https://www.instagram.com/abogadodeextranjeria/reel/DanHZ2Pu3bS/;Dónde nosotros residimos tenemos puros malandros alrededor de vecinos que están insultandonos y amedrentandonos y atacandonos a diario todo el día, con gritos y groserías en contra de nosotros, nadie hace nada al respecto, todos los días los denunció por redes sociales, tenemos temor por nuestras vidas, porque nos atacó la policía de Madrid, sin tener antecedentes penales ni antecedentes psiquiátricos, todo aquí en España y la gente nos ataca cuando salimos a la calle, nos insultan y nos manotean en la cara y en las espaldas. Estamos en calle de cantalapiedra 6. En línea 1 del metro Pinar de Chamartín Valdecarros. Son bandas criminales;;Julio
10-jul;abogadodeextranjeria;Instagram;Reel;https://www.instagram.com/abogadodeextranjeria/reel/DanHZ2Pu3bS/;https://www.instagram.com/p/DanC-EnI8Pp/?igsh=MW9mbXliOHU2eG1sOQ==;;Julio
10-jul;abogadodeextranjeria;Instagram;Reel;https://www.instagram.com/abogadodeextranjeria/reel/DanHZ2Pu3bS/;Hola buen día padres y hermanos entran en la reagrupación familiar?;;Julio
10-jul;abogadodeextranjeria;Instagram;Reel;https://www.instagram.com/abogadodeextranjeria/reel/DanHZ2Pu3bS/;Hola me ha llegado un documento para ir al sistema de salud y quedaron en enviarme una tarjeta. Ahora que debo hacer.;;Julio
10-jul;abogadodeextranjeria;Instagram;Reel;https://www.instagram.com/abogadodeextranjeria/reel/DanHZ2Pu3bS/;tengo un hijo español mayor de edad (25 años) , aplico como padre estando en España ?;;Julio
10-jul;abogadodeextranjeria;Instagram;Reel;https://www.instagram.com/abogadodeextranjeria/reel/DanHZ2Pu3bS/;De hijo a madre, se puede?;;Julio
10-jul;abogadodeextranjeria;Instagram;Reel;https://www.instagram.com/abogadodeextranjeria/reel/DanHZ2Pu3bS/;Los padres ?;;Julio
10-jul;abogadodeextranjeria;Instagram;Reel;https://www.instagram.com/abogadodeextranjeria/reel/DanHZ2Pu3bS/;Hola Abogado los hijos padres?;;Julio
10-jul;abogadodeextranjeria;Instagram;Reel;https://www.instagram.com/abogadodeextranjeria/reel/DanHZ2Pu3bS/;Los padres entran en esta agrupación?;;Julio
10-jul;abogadodeextranjeria;Instagram;Reel;https://www.instagram.com/abogadodeextranjeria/reel/DanHZ2Pu3bS/;Y si el familiar se encuentra en España ? Es posible?;;Julio
10-jul;abogadodeextranjeria;Instagram;Reel;https://www.instagram.com/abogadodeextranjeria/reel/DanHZ2Pu3bS/;Hola abogado mi esposa he hijos menores están es españa ellos lograron entrar en la regularización yo estoy en estados unidos la pregunta es mi esposa podría pedirme por reagrupacion familiar?;;Julio
10-jul;abogadodeextranjeria;Instagram;Reel;https://www.instagram.com/abogadodeextranjeria/reel/DanHZ2Pu3bS/;Mi hijo de 21 años entra en la reagrupación?;;Julio
10-jul;abogadodeextranjeria;Instagram;Reel;https://www.instagram.com/abogadodeextranjeria/reel/DanHZ2Pu3bS/;Football y’a voy me permite no se como puedo entrar en el campo del mister ?;;Julio
10-jul;abogadodeextranjeria;Instagram;Reel;https://www.instagram.com/abogadodeextranjeria/reel/DanHZ2Pu3bS/;Padres ancianos?;;Julio
08-jul;abogadodeextranjeria;Instagram;Reel;https://www.instagram.com/abogadodeextranjeria/reel/Dah-rYhuOmY/;Esperar ya casi dos meses, para que me llegue el Admitido a trámite, es una angustia total 😢;;Julio
08-jul;abogadodeextranjeria;Instagram;Reel;https://www.instagram.com/abogadodeextranjeria/reel/Dah-rYhuOmY/;Buenas tardes es normal que a la fecha no hayan admitido a trámite la solicitud de regularizacion , habiéndola presentado el 22 de abril de 2026?;;Julio
08-jul;abogadodeextranjeria;Instagram;Reel;https://www.instagram.com/abogadodeextranjeria/reel/Dah-rYhuOmY/;Hola qué tal, me ayudas con una duda, con la admisión a trámite se puede pasar a diferentes países de la unión europea?;;Julio
08-jul;abogadodeextranjeria;Instagram;Reel;https://www.instagram.com/abogadodeextranjeria/reel/Dah-rYhuOmY/;@carlosfrancisco.suarez.395 No, es admitido a trámite solo para España. Cuando ya tengas la TIE podrás viajar fuera de España, pero solo viajar, no te permite trabajar dentro de la UE.;;Julio
08-jul;abogadodeextranjeria;Instagram;Reel;https://www.instagram.com/abogadodeextranjeria/reel/Dah-rYhuOmY/;Hola Pau. Mi caso aún no ha sido admitido a trámite (no me llegó el correo) pero si ya me han asignado NIE y me ha llegado por correo físico el número de la seguridad social , todo esto sin admitirse a trámite, es normal ?;;Julio
08-jul;abogadodeextranjeria;Instagram;Reel;https://www.instagram.com/abogadodeextranjeria/reel/Dah-rYhuOmY/;Gracias 👏por tu responsabilidad como abogado Pau y como ser humano, gracias 👏👏👏;;Julio
08-jul;abogadodeextranjeria;Instagram;Reel;https://www.instagram.com/abogadodeextranjeria/reel/Dah-rYhuOmY/;Soy migrante y aun estoy esperando mi trámites ya que hace como 3 meses subí mis documentación para la regularización;;Julio
08-jul;abogadodeextranjeria;Instagram;Reel;https://www.instagram.com/abogadodeextranjeria/reel/Dah-rYhuOmY/;Pau una ayuda que me le hago entender ala empresa que por acabar el plazo de los 3 meses me dice que está vencido mi permiso ayuda porfavor;;Julio
08-jul;abogadodeextranjeria;Instagram;Reel;https://www.instagram.com/abogadodeextranjeria/reel/Dah-rYhuOmY/;Claro eso lo sabemos pero como le digo ala empresa que entienda eso;;Julio
08-jul;abogadodeextranjeria;Instagram;Reel;https://www.instagram.com/abogadodeextranjeria/reel/Dah-rYhuOmY/;Pregunta: cuanto están tardando en dar el favorable alguien lo sabe?;;Julio
08-jul;abogadodeextranjeria;Instagram;Reel;https://www.instagram.com/abogadodeextranjeria/reel/Dah-rYhuOmY/;@diana0925 te llegó después de la admisión?;;Julio
08-jul;abogadodeextranjeria;Instagram;Reel;https://www.instagram.com/abogadodeextranjeria/reel/Dah-rYhuOmY/;@diana0925 En la primera notificación que información te dieron?;;Julio
08-jul;abogadodeextranjeria;Instagram;Reel;https://www.instagram.com/abogadodeextranjeria/reel/Dah-rYhuOmY/;Tan bello hijo no querías crear ansiedad y preocupación para toda esta comunidad que te admira y quiere! Bravo!!!?;;Julio
08-jul;abogadodeextranjeria;Instagram;Reel;https://www.instagram.com/abogadodeextranjeria/reel/Dah-rYhuOmY/;mucho cuidado de este WhatsApp 632529671 están intentando estafar, te hacen videollamada haciendose pasar por @Ventura Extranjería Abogados Pau con IA ( me emocioné al verlo y hablar con él, no voy a negarlo) pero cuando me ofreció empleo y luego me dijo que había que pagar un exámen de admisión por 830€ supe que algo estaba mal, empecé a sacarle información haciéndole creer que iba a pagar este dinero, es increíble como te convencen y manipulan, seguro que hay mucha gente que va a caer, llame a denunciar pero dicen que no pueden hacer nada porque he sido la única persona que he informado de un caso así, si tienen este contacto, pidan empleo, cuando tengan información denuncien para que no caigan compatriotas 🙏🏻;;Julio
08-jul;abogadodeextranjeria;Instagram;Reel;https://www.instagram.com/abogadodeextranjeria/reel/Dah-rYhuOmY/;El problema es que hay más del doble de expedientes que pronosticaron, mucha gente con padrón, antecedentes falsos están colados, de otras partes de la UE que no han podido regularizarse en otros países colados también.;;Julio
08-jul;abogadodeextranjeria;Instagram;Reel;https://www.instagram.com/abogadodeextranjeria/reel/Dah-rYhuOmY/;"@giancarlomogollon1005 Bot serás tú con 200 seguidores, mientras los españoles sigamos tirando del carro; a vivir que son dos días. Cuando dejemos de tirar del carro, España va a terminar como vuestros países...";;Julio
08-jul;abogadodeextranjeria;Instagram;Reel;https://www.instagram.com/abogadodeextranjeria/reel/Dah-rYhuOmY/;@giancarlomogollon1005 bot facho ???? Necesito traductor por favor 🤣🤣;;Julio
08-jul;abogadodeextranjeria;Instagram;Reel;https://www.instagram.com/abogadodeextranjeria/reel/Dah-rYhuOmY/;Pau explicamos lo que está sucediendo en Andalucía con los inmigrantes y los cambios que están haciendo;;Julio
08-jul;abogadodeextranjeria;Instagram;Reel;https://www.instagram.com/abogadodeextranjeria/reel/Dah-rYhuOmY/;Señores migrantes que pronto tendrán ciudadanía española por favor los que piensen votar luego recordar quienes quisieron tumbar la regularización.;;Julio
08-jul;abogadodeextranjeria;Instagram;Reel;https://www.instagram.com/abogadodeextranjeria/reel/Dah-rYhuOmY/;@josbert17 y te fuiste a España donde gobierna la izquierda JAJAJAJA;;Julio
08-jul;abogadodeextranjeria;Instagram;Reel;https://www.instagram.com/abogadodeextranjeria/reel/Dah-rYhuOmY/;@jorgeecra parece que borró el comentario? 😝;;Julio
08-jul;abogadodeextranjeria;Instagram;Reel;https://www.instagram.com/abogadodeextranjeria/reel/Dah-rYhuOmY/;@walterseijas lo que no entiendo es porque un inmigrante que está viviendo en un país gobernado por la izquierda que le está dando documentos dice que no votaría por ellos entoces que hace aquí 🤔🤔🤔;;Julio
08-jul;abogadodeextranjeria;Instagram;Reel;https://www.instagram.com/abogadodeextranjeria/reel/Dah-rYhuOmY/;@josbert17 pero amigo, dices que no votas por la izquierda pero fuiste a vivir en un país donde gobierna la izquierda, decidase jajajaja;;Julio
08-jul;abogadodeextranjeria;Instagram;Reel;https://www.instagram.com/abogadodeextranjeria/reel/Dah-rYhuOmY/;@josbert17 y Que haces aquí ? Espero que seas el primer deportado. Vendudo. Igual que los latinos for trump. Cuando vas a entender que a la derecha le importas una papa ? Si la izquierda es una mierda pero la derecha es peor para alguien como tú.;;Julio
08-jul;abogadodeextranjeria;Instagram;Reel;https://www.instagram.com/abogadodeextranjeria/reel/Dah-rYhuOmY/;Tu crees que la izquierda te quiere mucho? Jajaja solo quieren tu voto y ya.;;Julio
08-jul;abogadodeextranjeria;Instagram;Reel;https://www.instagram.com/abogadodeextranjeria/reel/Dah-rYhuOmY/;Nunca tan mal se vivió en España como desde que está este gobierno, tiene mérito arruinar tan rápido todo por lo que lucharon nuestros padres y abuelos durante décadas...;;Julio
08-jul;abogadodeextranjeria;Instagram;Reel;https://www.instagram.com/abogadodeextranjeria/reel/Dah-rYhuOmY/;@fn_ree203 disculpa me puedes explicar al final que significa eso ?;;Julio
08-jul;abogadodeextranjeria;Instagram;Reel;https://www.instagram.com/abogadodeextranjeria/reel/Dah-rYhuOmY/;Cómo entro al portal de empleo y como pago;;Julio
08-jul;abogadodeextranjeria;Instagram;Reel;https://www.instagram.com/abogadodeextranjeria/reel/Dah-rYhuOmY/;Buenas amigo yo trabajo en negro y la señora donde trabajo no quiere hacerme contrato porque dice que tiene que pagar mu ho de seguridad social;;Julio
08-jul;abogadodeextranjeria;Instagram;Reel;https://www.instagram.com/abogadodeextranjeria/reel/Dah-rYhuOmY/;GRACIAS DIOS PREFIERO ESPERAR A QUE USTED SALGA A EXPLICARNOS Y HAY SI CREER 🙏🙏🙏;;Julio
08-jul;abogadodeextranjeria;Instagram;Reel;https://www.instagram.com/abogadodeextranjeria/reel/Dah-rYhuOmY/;Entonces el vídeo que vi era IA?? Porque en el usted decía que la reguralizacion ya no iba debido a los problemas políticos internos de España.;;Julio
08-jul;abogadodeextranjeria;Instagram;Reel;https://www.instagram.com/abogadodeextranjeria/reel/Dah-rYhuOmY/;Si hay que tenerlo en cuenta pero también tengan en cuenta que esto no da derecho a votar no desinformen por favor;;Julio
08-jul;abogadodeextranjeria;Instagram;Reel;https://www.instagram.com/abogadodeextranjeria/reel/Dah-rYhuOmY/;Y hasta cuándo seguirá en trámite los papeles de la regularización?;;Julio
08-jul;abogadodeextranjeria;Instagram;Reel;https://www.instagram.com/abogadodeextranjeria/reel/Dah-rYhuOmY/;👏👏👏👏👏👏👏👏👏👏Gracias Dios,por lo menos una noticia buena, entre tanto dolor, tristeza.. y depresión!!.. porqué nos odian tanto, si los buenos somos más?;;Julio
08-jul;abogadodeextranjeria;Instagram;Reel;https://www.instagram.com/abogadodeextranjeria/reel/Dah-rYhuOmY/;Tengo una duda lo que se expone en el vídeo es de la primera propuesta de medida cautelar o es de la segunda medida cautelar?;;Julio
08-jul;abogadodeextranjeria;Instagram;Reel;https://www.instagram.com/abogadodeextranjeria/reel/Dah-rYhuOmY/;PAU SIEMPRE QUE SALE UNA NUEVA NOTICIA DE LA REGULARIZACION Y TU NO DIC3S NADA NO SAB3S LA CALMA QUE TRASMITES, SABEMOS 1UE NO ES POR QUE NO TE ENTERAS SI NO MAS BIE.N POR QUE NO ESPECULAS NI TE GUSTA PONERNOS NERVIOSOS O ASUSTADOS . GRACIAS POR SER TAN HONRADO Y CON TANTA CALIDAD HUMANA😍;;Julio
08-jul;abogadodeextranjeria;Instagram;Reel;https://www.instagram.com/abogadodeextranjeria/reel/Dah-rYhuOmY/;Gracias a Dios 🙏🙏🙏🙏🙏 solo queda adecuarse, respetar y que nos respeten hacer las cosas bien para Adelante como el elefante !!!;;Julio
08-jul;abogadodeextranjeria;Instagram;Reel;https://www.instagram.com/abogadodeextranjeria/reel/Dah-rYhuOmY/;Qué significa esto ?;;Julio
08-jul;abogadodeextranjeria;Instagram;Reel;https://www.instagram.com/abogadodeextranjeria/reel/Dah-rYhuOmY/;Pau... comp vas? Para llenar el formulario de las hojas de vida para la.bolsa de empleo, pide el NIE y ese número no lo tenemos si estamos fuera de España. Como se haría en ese caso?? Gracias;;Julio
08-jul;abogadodeextranjeria;Instagram;Reel;https://www.instagram.com/abogadodeextranjeria/reel/Dah-rYhuOmY/;👏👏👏 Así es abogado, el otro día vi uno por ahí escudándose que lo decía porque quería informar y no como otros q no dicen nada, cuando hacer eso es alarmar a las personas y no sabes quien sufre de ansiedad o estrés, y eso le enferme;;Julio
08-jul;abogadodeextranjeria;Instagram;Reel;https://www.instagram.com/abogadodeextranjeria/reel/Dah-rYhuOmY/;Es increíble que después de todo sigas ayudando a las personas para que no se pongan nerviosas o se sientan frustradas ya que el 30 de junio ( mes pasado ) fue el último día para que la gente pueda meter sus papeles para la regularización, independientemente de que seas un abogado de extranjería, eres un gran ser humano, DIOS te ayude a seguir ayudando a más gente vulnerable que la esté pasando mal por tema de papeles, nunca dejes de ser la gran persona que eres @abogadodeextranjeria;;Julio
08-jul;abogadodeextranjeria;Instagram;Reel;https://www.instagram.com/abogadodeextranjeria/reel/Dah-rYhuOmY/;Pero si solo sirve para trabajar y hacer vida en España porque tendría que tomar estancias más allá ? Me explican;;Julio
08-jul;abogadodeextranjeria;Instagram;Reel;https://www.instagram.com/abogadodeextranjeria/reel/Dah-rYhuOmY/;Dr. Pau, muchas gracias por esa excelente noticia, nos alegra mucho el corazón. Dios lo bendiga. Siempre nos da muy gratas noticias, no sé cómo le hace para saber de primera mano esas noticias antes que otros, pero es muy bueno lo que hace.;;Julio
08-jul;abogadodeextranjeria;Instagram;Reel;https://www.instagram.com/abogadodeextranjeria/reel/Dah-rYhuOmY/;gracias @abogadodeextranjeria 🙏 he confiado mucho en Dios Padre y te he puesto en mis oraciones para que Él siempre te de el descernimiento de tu profesión ante lo que vivimos y necesitamos de ésta regularización 🙏🙂❤️;;Julio
08-jul;abogadodeextranjeria;Instagram;Reel;https://www.instagram.com/abogadodeextranjeria/reel/Dah-rYhuOmY/;En Valladolid no hay aprobaciones ni negaciones de este proceso de regularización. Que está pasando si ya pasaron los 3 meses??;;Julio
08-jul;abogadodeextranjeria;Instagram;Reel;https://www.instagram.com/abogadodeextranjeria/reel/Dah-rYhuOmY/;La comunidad Valenciana debería poner ojo a los que trabajan en negr0 recojiendo las naranjas y cuidado adultos mayores , eso sí no lo paran?;;Julio
08-jul;abogadodeextranjeria;Instagram;Reel;https://www.instagram.com/abogadodeextranjeria/reel/Dah-rYhuOmY/;Tengo 2 meses en España y no sé qué hacer alguien me puede guiar?;;Julio
08-jul;abogadodeextranjeria;Instagram;Reel;https://www.instagram.com/abogadodeextranjeria/reel/Dah-rYhuOmY/;Gracias por qué yo ya estaba super asustada ❤️;;Julio
08-jul;abogadodeextranjeria;Instagram;Reel;https://www.instagram.com/abogadodeextranjeria/reel/DahnYeaOBGM/;Saludos! Ustedes se encargan también del Trámite de Modificación?;;Julio
08-jul;abogadodeextranjeria;Instagram;Reel;https://www.instagram.com/abogadodeextranjeria/reel/DahnYeaOBGM/;se puede viajar dentro de europa teniendo el permiso provisional que da la admisión a trámite?;;Julio
08-jul;abogadodeextranjeria;Instagram;Reel;https://www.instagram.com/abogadodeextranjeria/reel/DahnYeaOBGM/;Hola gracias, si ayer lo hice así como dices y no me sale si no en trámite pero nada más, ni nie ni permiso ni nada;;Julio
08-jul;abogadodeextranjeria;Instagram;Reel;https://www.instagram.com/abogadodeextranjeria/reel/DahnYeaOBGM/;Buenos días. No consigo citas para recoger las tarjetas de mi hija y la mía. Es muy complicado. Cómo podrás ayudarme en eso? Por favor, gracias;;Julio
08-jul;abogadodeextranjeria;Instagram;Reel;https://www.instagram.com/abogadodeextranjeria/reel/DahnYeaOBGM/;Paul buen día, yo necesito el documento que tú dices que podrías darnos para presentar a la empresa por el tema de los 3 meses, como podría solicitarlo, gracias;;Julio
08-jul;abogadodeextranjeria;Instagram;Reel;https://www.instagram.com/abogadodeextranjeria/reel/DahnYeaOBGM/;Y si he presentado el en abril y todavía no me ha llegado la admisión a trámite es normal ?;;Julio
08-jul;abogadodeextranjeria;Instagram;Reel;https://www.instagram.com/abogadodeextranjeria/reel/DahnYeaOBGM/;Buenos días Pau, realicé mi registro el día 21 de abril y hasta la fecha no tengo asignado NRO de NIE ni admisión a trámite, que podría hacer?;;Julio
08-jul;abogadodeextranjeria;Instagram;Reel;https://www.instagram.com/abogadodeextranjeria/reel/DahnYeaOBGM/;Las citas para las huellas las pide uno?;;Julio
08-jul;abogadodeextranjeria;Instagram;Reel;https://www.instagram.com/abogadodeextranjeria/reel/DahnYeaOBGM/;@aquileo_gonzales1 ya tienes el favorable ?;;Julio
08-jul;abogadodeextranjeria;Instagram;Reel;https://www.instagram.com/abogadodeextranjeria/reel/DahnYeaOBGM/;Cuanto te tardo en asignarte el número de NIE?;;Julio
08-jul;abogadodeextranjeria;Instagram;Reel;https://www.instagram.com/abogadodeextranjeria/reel/DahnYeaOBGM/;Como te llegó? Lo hiciste con abogado...yo ya tengo el NIE y pague la tasa, pero la primera resolución aún no;;Julio
08-jul;abogadodeextranjeria;Instagram;Reel;https://www.instagram.com/abogadodeextranjeria/reel/DahnYeaOBGM/;Buenas Pau, cómo se le puede hacer entender al empleador lo de los 3 meses y la desestimación al momento de no querer contratarte para una empresa con la admisión a trámite?;;Julio
08-jul;abogadodeextranjeria;Instagram;Reel;https://www.instagram.com/abogadodeextranjeria/reel/DahnYeaOBGM/;Hola Pau, yo tengo admisión a trámite, Pero la hoja blanca se me vence el 17 de Julio, debo renovar esa hoja, o no hace falta??;;Julio
08-jul;abogadodeextranjeria;Instagram;Reel;https://www.instagram.com/abogadodeextranjeria/reel/DahnYeaOBGM/;Hola Pau buenas tardes, veo en trámite de extranjería que ya tengo asignado número de NIE pero no me ha llegado información de admisión a trámite, que podría hacer?;;Julio
08-jul;abogadodeextranjeria;Instagram;Reel;https://www.instagram.com/abogadodeextranjeria/reel/DahnYeaOBGM/;Hola, quisiera comunicarme con la oficina de bogota colombia? Me podrías ayudar con el número de contacto o como puedo agendar una cita aquíen bogota ?;;Julio
08-jul;abogadodeextranjeria;Instagram;Reel;https://www.instagram.com/abogadodeextranjeria/reel/DahnYeaOBGM/;Hola Pau, buenos dias, yo tengo mi admision a tramite y mi permiso de trabajo, estoy esperando a que salga mi resolución, comence a trabajar en un lugar pero me estan diciendo que como no me salga la resolución antes de los 3 meses de vigor del permiso de trabajo me van a echar, por lo que, queria consultar si habia alguna forma de poder resolver ésta situación para que quedarme sin trabajo. Muchas gracias y buenos días;;Julio
08-jul;abogadodeextranjeria;Instagram;Reel;https://www.instagram.com/abogadodeextranjeria/reel/DahnYeaOBGM/;@abogadodeextranjeria podrías ayudarnos con esta pregunta ?, así estamos nosotras no, no quieren dar trabajo por que el permiso es de 3 meses y eso es lo que dura los meses de prueba.;;Julio
08-jul;abogadodeextranjeria;Instagram;Reel;https://www.instagram.com/abogadodeextranjeria/reel/DahnYeaOBGM/;Si no tengo respuesta de mi trámite de regularización y se me va a vencer la tarjeta roja que debo hacer??;;Julio
08-jul;abogadodeextranjeria;Instagram;Reel;https://www.instagram.com/abogadodeextranjeria/reel/DahnYeaOBGM/;@paulanguloh vale gracias si uno queda con una duda, pues lo bueno sería que al menos nos llegue alguna notificación como va el proceso, pero bueno que todo va con calma;;Julio
